libname,memname,memtype,name,type,length,npos,varnum,label,format,informat,idxusage,sortedby,xtype,notnull,precision,scale,transcode
NSFG,MALEDATA_2015_2017,DATA,CASEID,num,6,1032,1,Respondent ID number,CASEID.,,,0,num,no,0,,yes
NSFG,MALEDATA_2015_2017,DATA,RSCRNINF,num,3,1038,2,Whether R was also the screener informant,Y1N5C.,,,0,num,no,0,,yes
NSFG,MALEDATA_2015_2017,DATA,RSCRAGE,num,3,1041,3,R's age as reported in screener,AGESCRN.,,,0,num,no,0,,yes
NSFG,MALEDATA_2015_2017,DATA,RSCRHISP,num,3,1044,4,R's Hispanic origin as reported in screener,Y1N5RDF.,,,0,num,no,0,,yes
NSFG,MALEDATA_2015_2017,DATA,RSCRRACE,num,3,1047,5,R's race as reported in screener,RSCRRACE.,,,0,num,no,0,,yes
NSFG,MALEDATA_2015_2017,DATA,AGE_A,num,3,1050,6,AA-1 R's age at interview,AGEFMT.,,,0,num,no,0,,yes
NSFG,MALEDATA_2015_2017,DATA,AGE_R,num,3,1053,7,R's age at interview,AGEFMT.,,,0,num,no,0,,yes
NSFG,MALEDATA_2015_2017,DATA,AGESCRN,num,3,1056,8,R's age at screener,AGESCRN.,,,0,num,no,0,,yes
NSFG,MALEDATA_2015_2017,DATA,HISP,num,3,1059,9,AC-1 R is of Hispanic/Latino origin,Y1N5RDF.,,,0,num,no,0,,yes
NSFG,MALEDATA_2015_2017,DATA,HISPGRP,num,3,1062,10,AC-2 Hispanic/Latino origin -- group,HISPGRPF.,,,0,num,no,0,,yes
NSFG,MALEDATA_2015_2017,DATA,PRIMLANG1,num,3,1065,11,AC-6 Language spoken in home - 1st mention,PRIMLANGF.,,,0,num,no,0,,yes
NSFG,MALEDATA_2015_2017,DATA,PRIMLANG2,num,3,1068,12,AC-6 Language spoken in home - 2nd mention,PRIMLANGF.,,,0,num,no,0,,yes
NSFG,MALEDATA_2015_2017,DATA,PRIMLANG3,num,3,1071,13,AC-6 Language spoken in home - 3rd mention,PRIMLANGF.,,,0,num,no,0,,yes
NSFG,MALEDATA_2015_2017,DATA,ROSCNT,num,3,1074,14,Total number of HH members based on HH roster,ROSCNT.,,,0,num,no,0,,yes
NSFG,MALEDATA_2015_2017,DATA,MARSTAT,num,3,1077,15,AD-7b R's marital status,MARSTAT.,,,0,num,no,0,,yes
NSFG,MALEDATA_2015_2017,DATA,FMARSTAT,num,3,1080,16,AD-7c R's formal marital status,FMARSTAT.,,,0,num,no,0,,yes
NSFG,MALEDATA_2015_2017,DATA,FMARIT,num,3,1083,17,Formal marital status at time of interview,FMARITF.,,,0,num,no,0,,yes
NSFG,MALEDATA_2015_2017,DATA,EVRMARRY,num,3,1086,18,Whether R was ever married,EVRMARRY.,,,0,num,no,0,,yes
NSFG,MALEDATA_2015_2017,DATA,WPLOCALE,num,3,1089,19,AD-8 Where R's current wife/partner lives,WPLOCALE.,,,0,num,no,0,,yes
NSFG,MALEDATA_2015_2017,DATA,WOMREL,num,3,1092,20,Woman in HH is R's wife or cohabiting partner,WOMREL.,,,0,num,no,0,,yes
NSFG,MALEDATA_2015_2017,DATA,GOSCHOL,num,3,1095,21,AE-1 R currently enrolled in regular school,Y1N5RDF.,,,0,num,no,0,,yes
NSFG,MALEDATA_2015_2017,DATA,VACA,num,3,1098,22,AE-2 R on vacation from school,Y1N5RDF.,,,0,num,no,0,,yes
NSFG,MALEDATA_2015_2017,DATA,HIGRADE,num,3,1101,23,AE-3 R's current grade in school or highest grade/year attended,HIGRADE.,,,0,num,no,0,,yes
NSFG,MALEDATA_2015_2017,DATA,COMPGRD,num,3,1104,24,AE-4 R completed current grade or highest grade/year attended,Y1N5RDF.,,,0,num,no,0,,yes
NSFG,MALEDATA_2015_2017,DATA,DIPGED,num,3,1107,25,"AE-6 Which - high school diploma, GED, or both - does R have?",DIPGED.,,,0,num,no,0,,yes
NSFG,MALEDATA_2015_2017,DATA,EARNHS_Y,num,4,16,26,AE-7 Year high school diploma obtained,YEARFMT.,,,0,num,no,0,,yes
NSFG,MALEDATA_2015_2017,DATA,HISCHGRD,num,3,1110,27,"AE-8 R not in sch, no dipl-last grade of elem/jr/hi sch attended",HISCHGRD.,,,0,num,no,0,,yes
NSFG,MALEDATA_2015_2017,DATA,LSTGRADE,num,3,1113,28,Highest grade of elem/junior/high school R attended,LSTGRADE.,,,0,num,no,0,,yes
NSFG,MALEDATA_2015_2017,DATA,MYSCHOL_Y,num,4,20,29,AE-9 Year R last attended elem/jr/hi sch-R not in sch/no dipl,YEARFMT.,,,0,num,no,0,,yes
NSFG,MALEDATA_2015_2017,DATA,HAVEDEG,num,3,1116,30,AE-10 R has college or university degree,Y1N5RDF.,,,0,num,no,0,,yes
NSFG,MALEDATA_2015_2017,DATA,DEGREES,num,3,1119,31,AE-11 R's highest college or university degree received,DEGREES.,,,0,num,no,0,,yes
NSFG,MALEDATA_2015_2017,DATA,EARNBA_Y,num,4,24,32,AE-12 Year R received his Bachelor's degree,YEARFMT.,,,0,num,no,0,,yes
NSFG,MALEDATA_2015_2017,DATA,EXPSCHL,num,3,1122,33,AE-13 Expect to go back to school,Y1N5RDF.,,,0,num,no,0,,yes
NSFG,MALEDATA_2015_2017,DATA,EXPGRADE,num,3,1125,34,AE-14 Highest grade/degree expect to complete,EXPGRADE2F.,,,0,num,no,0,,yes
NSFG,MALEDATA_2015_2017,DATA,WTHPARNW,num,3,1128,35,R is living with parents or parent figures - based on HH roster,WTHPARNW.,,,0,num,no,0,,yes
NSFG,MALEDATA_2015_2017,DATA,ONOWN,num,3,1131,36,AF-0a Did R ever live away from parents/guardians before age 18,Y1N5RDF.,,,0,num,no,0,,yes
NSFG,MALEDATA_2015_2017,DATA,ONOWN18,num,3,1134,37,Whether R lived on own before age 18,Y1N5RDF.,,,0,num,no,0,,yes
NSFG,MALEDATA_2015_2017,DATA,INTACT,num,3,1137,38,AF-1 R always lived with both biological/adoptive parents,Y1N5RDF.,,,0,num,no,0,,yes
NSFG,MALEDATA_2015_2017,DATA,PARMARR,num,3,1140,39,AF-2 R's biological parents married at R's birth,Y1N5RDF.,,,0,num,no,0,,yes
NSFG,MALEDATA_2015_2017,DATA,INTACT18,num,3,1143,40,Whether R lived in intact family from birth to age 18,Y1N2RDF.,,,0,num,no,0,,yes
NSFG,MALEDATA_2015_2017,DATA,LVSIT14F,num,3,1146,41,AF-3 Female parent/parent-figure at age 14 - fam not intact thru 18,LVSIT14F.,,,0,num,no,0,,yes
NSFG,MALEDATA_2015_2017,DATA,LVSIT14M,num,3,1149,42,AF-4 Male parent/parent-figure at age 14 - fam not intact thru 18,MALFIGF.,,,0,num,no,0,,yes
NSFG,MALEDATA_2015_2017,DATA,WOMRASDU,num,3,1152,43,AF-5 Woman who raised R during teens - fam not intact thru 18,WOMRASDU.,,,0,num,no,0,,yes
NSFG,MALEDATA_2015_2017,DATA,MOMDEGRE,num,3,1155,44,AF-6 Highest level of education female parent (figure) completed,MDDEGRE.,,,0,num,no,0,,yes
NSFG,MALEDATA_2015_2017,DATA,MOMWORKD,num,3,1158,45,AF-7 Female parent (figure) worked full/parttime when R was 5-15,MOMWORKD.,,,0,num,no,0,,yes
NSFG,MALEDATA_2015_2017,DATA,MOMFSTCH,num,3,1161,46,AF-9 Age of female parent (figure) at her first birth,MOMFSTCH.,,,0,num,no,0,,yes
NSFG,MALEDATA_2015_2017,DATA,MOM18,num,3,1164,47,AF-10 Estimated age of female parent (figure) at her first birth,MOM18F.,,,0,num,no,0,,yes
NSFG,MALEDATA_2015_2017,DATA,MANRASDU,num,3,1167,48,AF-11 Man who raised R during teens - fam not intact thru 18,MALFIGF.,,,0,num,no,0,,yes
NSFG,MALEDATA_2015_2017,DATA,R_FOSTER,num,3,1170,49,Whether R is living/has lived with a foster parent (FC A-24a),R_FOSTER.,,,0,num,no,0,,yes
NSFG,MALEDATA_2015_2017,DATA,EVRFSTER,num,3,1173,50,AF-13 R ever lived in a foster home,Y1N5RDF.,,,0,num,no,0,,yes
NSFG,MALEDATA_2015_2017,DATA,MNYFSTER,num,3,1176,51,AF-14 Number of foster homes R lived in,MNYFSTER.,,,0,num,no,0,,yes
NSFG,MALEDATA_2015_2017,DATA,DURFSTER,num,3,1179,52,AF-15 Total time spent in foster care,DURFSTER.,,,0,num,no,0,,yes
NSFG,MALEDATA_2015_2017,DATA,TIMESMAR,num,3,1182,53,AG-2 How many times R has been married - R ever married,TIMESMAR.,,,0,num,no,0,,yes
NSFG,MALEDATA_2015_2017,DATA,EVCOHAB1,num,3,1185,54,AG-3 R ever cohabited (excluding wives) - R ever married,Y1N5RDF.,,,0,num,no,0,,yes
NSFG,MALEDATA_2015_2017,DATA,NUMCOH1,num,3,1188,55,AG-4 Number of women R has lived with-excl wives-R ever married,NUMCOH2F.,,,0,num,no,0,,yes
NSFG,MALEDATA_2015_2017,DATA,EVCOHAB2,num,3,1191,56,"AG-5 R ever cohabited - R never married, not curr cohabiting",Y1N5RDF.,,,0,num,no,0,,yes
NSFG,MALEDATA_2015_2017,DATA,NUMCOH2,num,3,1194,57,AG-6 Number of women R has lived with-R never marr & ever cohab,NUMCOH2F.,,,0,num,no,0,,yes
NSFG,MALEDATA_2015_2017,DATA,EVRCOHAB,num,3,1197,58,Whether R ever cohabited with a woman (excluding wives),N0Y1RDF.,,,0,num,no,0,,yes
NSFG,MALEDATA_2015_2017,DATA,NUMWIFE,num,4,28,59,Number of wives,NUMWIFE.,,,0,num,no,0,,yes
NSFG,MALEDATA_2015_2017,DATA,NUMCOHAB,num,4,32,60,Number of female cohabiting partners (excluding wives),NUMCOHAB.,,,0,num,no,0,,yes
NSFG,MALEDATA_2015_2017,DATA,EVERSEX,num,3,1200,61,BA-1 Ever had sexual intercourse with a female,Y1N5RDF.,,,0,num,no,0,,yes
NSFG,MALEDATA_2015_2017,DATA,RHADSEX,num,3,1203,62,Whether R Has Ever Had Sex (Vaginal Intercourse),RHADSEX.,,,0,num,no,0,,yes
NSFG,MALEDATA_2015_2017,DATA,SXMTONCE,num,3,1206,63,BA-2 Has R had sexual intercourse more than once,Y1N5RDF.,,,0,num,no,0,,yes
NSFG,MALEDATA_2015_2017,DATA,YNOSEX,num,3,1209,64,BA-3 Main Reason Why R Has Not Had Intercourse with a Female,YNOSEX.,,,0,num,no,0,,yes
NSFG,MALEDATA_2015_2017,DATA,TALKPAR1,num,3,1212,65,BA-4 Sex Ed Topics R Has Discussed with Parents -1st Mention,TALKPARF.,,,0,num,no,0,,yes
NSFG,MALEDATA_2015_2017,DATA,TALKPAR2,num,3,1215,66,BA-4 Sex Ed Topics R Has Discussed with Parents -2nd Mention,TALKPARF.,,,0,num,no,0,,yes
NSFG,MALEDATA_2015_2017,DATA,TALKPAR3,num,3,1218,67,BA-4 Sex Ed Topics R Has Discussed with Parents -3rd Mention,TALKPARF.,,,0,num,no,0,,yes
NSFG,MALEDATA_2015_2017,DATA,TALKPAR4,num,3,1221,68,BA-4 Sex Ed Topics R Has Discussed with Parents -4th Mention,TALKPARF.,,,0,num,no,0,,yes
NSFG,MALEDATA_2015_2017,DATA,TALKPAR5,num,3,1224,69,BA-4 Sex Ed Topics R Has Discussed with Parents -5th Mention,TALKPARF.,,,0,num,no,0,,yes
NSFG,MALEDATA_2015_2017,DATA,TALKPAR6,num,3,1227,70,BA-4 Sex Ed Topics R Has Discussed with Parents -6th Mention,TALKPARF.,,,0,num,no,0,,yes
NSFG,MALEDATA_2015_2017,DATA,TALKPAR7,num,3,1230,71,BA-4 Sex Ed Topics R Has Discussed with Parents -7th Mention,TALKPARF.,,,0,num,no,0,,yes
NSFG,MALEDATA_2015_2017,DATA,SEDNO,num,3,1233,72,BA-5 Formal Sex Ed Before 18: How to Say No to Sex,Y1N5RDF.,,,0,num,no,0,,yes
NSFG,MALEDATA_2015_2017,DATA,SEDNOG,num,3,1236,73,BA-6 Grade R Received Sex Ed on How to Say No to Sex,SEDGRDF.,,,0,num,no,0,,yes
NSFG,MALEDATA_2015_2017,DATA,SEDNOSX,num,3,1239,74,BA-7 R rec'd instruction-how say no to sex before/after 1st sex?,SEDBFAFF.,,,0,num,no,0,,yes
NSFG,MALEDATA_2015_2017,DATA,SEDBC,num,3,1242,75,BA-8 Formal Sex Ed Before 18: Methods of Birth Control,Y1N5RDF.,,,0,num,no,0,,yes
NSFG,MALEDATA_2015_2017,DATA,SEDBCLC1,num,3,1245,76,BA-8a Place where received instructions on methods of birth control-1st Mention,SXEDWHRINS.,,,0,num,no,0,,yes
NSFG,MALEDATA_2015_2017,DATA,SEDBCLC2,num,3,1248,77,BA-8a Place where received instructions on methods of birth control-2nd Mention,SXEDWHRINS.,,,0,num,no,0,,yes
NSFG,MALEDATA_2015_2017,DATA,SEDBCLC3,num,3,1251,78,BA-8a Place where received instructions on methods of birth control-3rd Mention,SXEDWHRINS.,,,0,num,no,0,,yes
NSFG,MALEDATA_2015_2017,DATA,SEDBCLC4,num,3,1254,79,BA-8a Place where received instructions on methods of birth control-4th Mention,SXEDWHRINS.,,,0,num,no,0,,yes
NSFG,MALEDATA_2015_2017,DATA,SEDBCG,num,3,1257,80,BA-9 R's Grade When Received Instruction on Birth Control,SEDGRDF.,,,0,num,no,0,,yes
NSFG,MALEDATA_2015_2017,DATA,SEDBCSX,num,3,1260,81,BA-10 R rec'd instruction-birth control before/after 1st sex?,SEDBFAFF.,,,0,num,no,0,,yes
NSFG,MALEDATA_2015_2017,DATA,SEDWHBC,num,3,1263,82,BA-11 Formal Sex Ed Before 18: Where to Get Birth Control,Y1N5RDF.,,,0,num,no,0,,yes
NSFG,MALEDATA_2015_2017,DATA,SEDWHBCG,num,3,1266,83,BA-12 R's Grade When Received Instruction on Where to Get Birth Control,SEDGRDF.,,,0,num,no,0,,yes
NSFG,MALEDATA_2015_2017,DATA,SEDWBCSX,num,3,1269,84,BA-13 R rec'd Instruction-Where to Get Birth Control before/after 1st sex,SEDBFAFF.,,,0,num,no,0,,yes
NSFG,MALEDATA_2015_2017,DATA,SEDCOND,num,3,1272,85,BA-14 Formal Sex Ed Before 18: How to Use a Condom,Y1N5RDF.,,,0,num,no,0,,yes
NSFG,MALEDATA_2015_2017,DATA,SEDCONDG,num,3,1275,86,BA-15 R's Grade When Received Instruction on How to Use a Condom,SEDGRDF.,,,0,num,no,0,,yes
NSFG,MALEDATA_2015_2017,DATA,SEDCONSX,num,3,1278,87,BA-16 R rec'd Instruction-How to Use a Condom before/after 1st sex,SEDBFAFF.,,,0,num,no,0,,yes
NSFG,MALEDATA_2015_2017,DATA,SEDSTD,num,3,1281,88,BA-17 Formal Sex Ed Before 18: STDs,Y1N5RDF.,,,0,num,no,0,,yes
NSFG,MALEDATA_2015_2017,DATA,SEDSTDG,num,3,1284,89,BA-18 R's Grade When Received Instruction on STDs,SEDGRDF.,,,0,num,no,0,,yes
NSFG,MALEDATA_2015_2017,DATA,SEDSTDSX,num,3,1287,90,BA-19 R rec'd instruction on STDs before/after 1st sex?,SEDBFAFF.,,,0,num,no,0,,yes
NSFG,MALEDATA_2015_2017,DATA,SEDHIV,num,3,1290,91,BA-20 Formal Sex Ed Before 18: how prevent HIV/AIDS,Y1N5RDF.,,,0,num,no,0,,yes
NSFG,MALEDATA_2015_2017,DATA,SEDHIVG,num,3,1293,92,BA-21 R's Grade When Received Instruction on how prevent HIV/AIDS,SEDGRDF.,,,0,num,no,0,,yes
NSFG,MALEDATA_2015_2017,DATA,SEDHIVSX,num,3,1296,93,BA-22 R's instruction on how prevent HIV/AIDS before/after 1st sex?,SEDBFAFF.,,,0,num,no,0,,yes
NSFG,MALEDATA_2015_2017,DATA,SEDABST,num,3,1299,94,BA-23 Formal Sex Ed Before 18: Waiting Until Marriage,Y1N5RDF.,,,0,num,no,0,,yes
NSFG,MALEDATA_2015_2017,DATA,SEDABLC1,num,3,1302,95,BA-23a Place where received instruction about waiting until marriage to have sex-1st Mention,SXEDWHRINS.,,,0,num,no,0,,yes
NSFG,MALEDATA_2015_2017,DATA,SEDABLC2,num,3,1305,96,BA-23a Place where received instruction about waiting until marriage to have sex-2nd Mention,SXEDWHRINS.,,,0,num,no,0,,yes
NSFG,MALEDATA_2015_2017,DATA,SEDABLC3,num,3,1308,97,BA-23a Place where received instruction about waiting until marriage to have sex-3rd Mention,SXEDWHRINS.,,,0,num,no,0,,yes
NSFG,MALEDATA_2015_2017,DATA,SEDABLC4,num,3,1311,98,BA-23a Place where received instruction about waiting until marriage to have sex-4th Mention,SXEDWHRINS.,,,0,num,no,0,,yes
NSFG,MALEDATA_2015_2017,DATA,SEDABSTG,num,3,1314,99,BA-24 R s Grade When Received Instruction on Waiting Until Marriage,SEDGRDF.,,,0,num,no,0,,yes
NSFG,MALEDATA_2015_2017,DATA,SEDABSSX,num,3,1317,100,BA-25 R rec d instruction-Waiting Until Marriage before/after 1st sex,SEDBFAFF.,,,0,num,no,0,,yes
NSFG,MALEDATA_2015_2017,DATA,EVEROPER,num,3,1320,101,BB-1 Ever had vasectomy or other male sterilizing operation,Y1N5RDF.,,,0,num,no,0,,yes
NSFG,MALEDATA_2015_2017,DATA,TYPEOPER,num,3,1323,102,BB-2 Type of sterilizing operation R had,TYPEOPER.,,,0,num,no,0,,yes
NSFG,MALEDATA_2015_2017,DATA,STEROPER,num,3,1326,103,BB-3 R completely sterile from sterilizing operation,Y1N5RDF.,,,0,num,no,0,,yes
NSFG,MALEDATA_2015_2017,DATA,VASEC_Y,num,4,36,104,BB-4 Year R had vasectomy or other sterilizing operation,YEARFMT.,,,0,num,no,0,,yes
NSFG,MALEDATA_2015_2017,DATA,PLCSTROP,num,3,1329,105,BB-5 Place where vasectomy/other sterilizing operation was done,PLCSTROP.,,,0,num,no,0,,yes
NSFG,MALEDATA_2015_2017,DATA,RVRSVAS,num,3,1332,106,BB-6 Ever had surgery to reverse vasectomy,Y1N5RDF.,,,0,num,no,0,,yes
NSFG,MALEDATA_2015_2017,DATA,VASREV_Y,num,3,1335,107,BB-7 Year when R had vasectomy reversed,YEARFMT.,,,0,num,no,0,,yes
NSFG,MALEDATA_2015_2017,DATA,RSURGSTR,num,3,1338,108,Whether R is Surgically Sterile at Interview,N0Y1RDF.,,,0,num,no,0,,yes
NSFG,MALEDATA_2015_2017,DATA,FATHPOSS,num,3,1341,109,BB-8 Whether R is physically able to father a child,Y1N5RDF.,,,0,num,no,0,,yes
NSFG,MALEDATA_2015_2017,DATA,FATHDIFF,num,3,1344,110,BB-9 Whether R would have physical difficulty fathering a child,Y1N5RDF.,,,0,num,no,0,,yes
NSFG,MALEDATA_2015_2017,DATA,RSTRSTAT,num,3,1347,111,R's Sterility Status at Time of Interview,RSTRSTAT.,,,0,num,no,0,,yes
NSFG,MALEDATA_2015_2017,DATA,LIFEPRT,num,3,1350,112,BC-6 # of female sex partners in lifetime,LIFEPRT.,,,0,num,no,0,,yes
NSFG,MALEDATA_2015_2017,DATA,LIFEPRTS,num,3,1353,113,Number of female sex partners in lifetime,NUMPARTF.,,,0,num,no,0,,yes
NSFG,MALEDATA_2015_2017,DATA,SXMON12,num,3,1356,114,BC-7 Has R had sex in last 12 mos (if only 1 partner in life),Y1N5RDF.,,,0,num,no,0,,yes
NSFG,MALEDATA_2015_2017,DATA,MON12PRT,num,3,1359,115,BC-8 # female sex partners in last 12 mos (if >1 in life),MON12PRT.,,,0,num,no,0,,yes
NSFG,MALEDATA_2015_2017,DATA,MON12PRTS,num,3,1362,116,Number of female sex partners in last 12 months,NUMPARTF.,,,0,num,no,0,,yes
NSFG,MALEDATA_2015_2017,DATA,SEXSTAT,num,3,1365,117,Summary of R's lifetime and recent sexual experience,SEXSTAT.,,,0,num,no,0,,yes
NSFG,MALEDATA_2015_2017,DATA,P12MOCONO,num,3,1368,118,BC-8a use a condom that time,Y1N5RDF.,,,0,num,no,0,,yes
NSFG,MALEDATA_2015_2017,DATA,P12MOCON,num,3,1371,119,BC-8b How many times used condom during sex last 12 mons,OFTIMEF.,,,0,num,no,0,,yes
NSFG,MALEDATA_2015_2017,DATA,SEXFREQ,num,4,40,120,BC-9 # times had sex with female in last 4 weeks,SEXFREQ.,,,0,num,no,0,,yes
NSFG,MALEDATA_2015_2017,DATA,CONFREQ,num,4,44,121,BC-10 # times used condom when had sex with female in last 4 wks,SEXFREQ.,,,0,num,no,0,,yes
NSFG,MALEDATA_2015_2017,DATA,P1RLTN1,num,3,1374,122,BD-2 Ever married to last sex partner,Y1N5RDF.,,,0,num,no,0,,yes
NSFG,MALEDATA_2015_2017,DATA,P1CURRWIFE,num,3,1377,123,BD-3 Verifying if current wife = last sex partner,Y1N5RDF.,,,0,num,no,0,,yes
NSFG,MALEDATA_2015_2017,DATA,P1CURRSEP,num,3,1380,124,BD-4 Verifying if separated wife = last sex partner,Y1N5RDF.,,,0,num,no,0,,yes
NSFG,MALEDATA_2015_2017,DATA,P1RLTN2,num,3,1383,125,BD-5 Ever cohabited with last sex partner,Y1N5RDF.,,,0,num,no,0,,yes
NSFG,MALEDATA_2015_2017,DATA,P1COHABIT,num,3,1386,126,BD-6 Verifying if current cohab partner = last sex partner,Y1N5RDF.,,,0,num,no,0,,yes
NSFG,MALEDATA_2015_2017,DATA,P1SXLAST_M,num,3,1389,127,BD-7 Month when R last sex with last sexual partner,MNTHFMT.,,,0,num,no,0,,yes
NSFG,MALEDATA_2015_2017,DATA,P1SXLAST_Y,num,4,48,128,BD-8 Year when R last had sex with last sexual partner,YEARFMT.,,,0,num,no,0,,yes
NSFG,MALEDATA_2015_2017,DATA,CMLSXP1,num,4,52,129,CM for date of last sex with last sexual partner,CMFMT.,,,0,num,no,0,,yes
NSFG,MALEDATA_2015_2017,DATA,P2RLTN1,num,3,1392,130,BD-10 Ever married to 2nd-to-last sex partner in past 12 mons,Y1N5RDF.,,,0,num,no,0,,yes
NSFG,MALEDATA_2015_2017,DATA,P2CURRWIFE,num,3,1395,131,"BD-11 Verifying if curr wife=2nd-to-last sex partner, past 12 mos",Y1N5RDF.,,,0,num,no,0,,yes
NSFG,MALEDATA_2015_2017,DATA,P2CURRSEP,num,3,1398,132,"BD-12 Verify separated wife=2nd-to-last sex partner, past 12 mos",Y1N5RDF.,,,0,num,no,0,,yes
NSFG,MALEDATA_2015_2017,DATA,P2RLTN2,num,3,1401,133,BD-13 Ever lived with 2nd-to-last sex partner in past 12 mos,Y1N5RDF.,,,0,num,no,0,,yes
NSFG,MALEDATA_2015_2017,DATA,P2COHABIT,num,3,1404,134,"BD-14 Verify curr cohab partner=2nd-to-last sex partner, < 12 mos",Y1N5RDF.,,,0,num,no,0,,yes
NSFG,MALEDATA_2015_2017,DATA,P2SXLAST_M,num,3,1407,135,BD-15 Month when R last sex with 2nd-to-last partner in last 12 mos,MNTHFMT.,,,0,num,no,0,,yes
NSFG,MALEDATA_2015_2017,DATA,P2SXLAST_Y,num,4,56,136,BD-16 Yr R last had sex with 2nd-to-last partner in last 12 mos,YEARFMT.,,,0,num,no,0,,yes
NSFG,MALEDATA_2015_2017,DATA,CMLSXP2,num,4,60,137,CM for date of last sex with 2nd-to-last partner in last 12 mos,CMFMT.,,,0,num,no,0,,yes
NSFG,MALEDATA_2015_2017,DATA,P3RLTN1,num,3,1410,138,BD-18 Ever married to 3rd-to-last sex partner in past 12 mons,Y1N5RDF.,,,0,num,no,0,,yes
NSFG,MALEDATA_2015_2017,DATA,P3CURRWIFE,num,3,1413,139,"BD-19 Verifying if curr wife=3rd-to-last sex partner, past 12 mos",Y1N5RDF.,,,0,num,no,0,,yes
NSFG,MALEDATA_2015_2017,DATA,P3CURRSEP,num,3,1416,140,"BD-20 Verify separated wife=3rd-to-last sex partner, past 12 mos",Y1N5RDF.,,,0,num,no,0,,yes
NSFG,MALEDATA_2015_2017,DATA,P3RLTN2,num,3,1419,141,BD-21 Ever lived with 3rd-to-last sex partner in past 12 mos,Y1N5RDF.,,,0,num,no,0,,yes
NSFG,MALEDATA_2015_2017,DATA,P3COHABIT,num,3,1422,142,"BD-22 Verify curr cohab partner=3rd-to-last sex partner, < 12 mos",Y1N5RDF.,,,0,num,no,0,,yes
NSFG,MALEDATA_2015_2017,DATA,P3SXLAST_M,num,3,1425,143,BD-23 Month when R last sex with 3rd-to-last partner in last 12 mos,MNTHFMT.,,,0,num,no,0,,yes
NSFG,MALEDATA_2015_2017,DATA,P3SXLAST_Y,num,4,64,144,BD-24 Yr R last had sex with 3rd-to-last partner in last 12 mos,YEARFMT.,,,0,num,no,0,,yes
NSFG,MALEDATA_2015_2017,DATA,CMLSXP3,num,4,68,145,CM for date of last sex with 3rd-to-last partner in last 12 mos,CMFMT.,,,0,num,no,0,,yes
NSFG,MALEDATA_2015_2017,DATA,P1RELATION,num,3,1428,146,Relationship of R's most recent sex partner to R,PXRELATF.,,,0,num,no,0,,yes
NSFG,MALEDATA_2015_2017,DATA,P2RELATION,num,3,1431,147,Relationship of 2nd most recent sex partner in last 12 mos to R,PXRELATF.,,,0,num,no,0,,yes
NSFG,MALEDATA_2015_2017,DATA,P3RELATION,num,3,1434,148,Relationship of 3rd most recent sex partner in last 12 mos to R,PXRELATF.,,,0,num,no,0,,yes
NSFG,MALEDATA_2015_2017,DATA,FIRST,num,3,1437,149,BD-25 Verify if 1st sex partner = one of the recent sex partners,FIRST.,,,0,num,no,0,,yes
NSFG,MALEDATA_2015_2017,DATA,MARRDATE_Y,num,4,72,150,CA-2 Year of marriage to current wife,YEARFMT.,,,0,num,no,0,,yes
NSFG,MALEDATA_2015_2017,DATA,HISAGEM,num,3,1440,151,CA-3 R's age when married - current wife,AGESELF.,,,0,num,no,0,,yes
NSFG,MALEDATA_2015_2017,DATA,LIVTOGWF,num,3,1443,152,CA-4 Ever cohabited premaritally with current wife,Y1N5RDF.,,,0,num,no,0,,yes
NSFG,MALEDATA_2015_2017,DATA,STRTWFCP_Y,num,4,76,153,CA-5 Year 1st began living together w/ current W/P,YEARFMT.,,,0,num,no,0,,yes
NSFG,MALEDATA_2015_2017,DATA,HISAGEC,num,3,1446,154,CA-6 R's age when began living together w/ current W/P,AGESELF.,,,0,num,no,0,,yes
NSFG,MALEDATA_2015_2017,DATA,CMSTRTWP,num,4,80,155,Year current union began,YEARFMT.,,,0,num,no,0,,yes
NSFG,MALEDATA_2015_2017,DATA,ENGATHEN,num,3,1449,156,CA-7 Engaged when began living together w/ current W/P,ENGAGF.,,,0,num,no,0,,yes
NSFG,MALEDATA_2015_2017,DATA,WILLMARR,num,3,1452,157,CA-8 R thinks he will marry current cohabiting partner,DEFPROBF.,,,0,num,no,0,,yes
NSFG,MALEDATA_2015_2017,DATA,CWPDOB_Y,num,4,84,158,CB-1 Year when R's current W/P was born,YEARFMT.,,,0,num,no,0,,yes
NSFG,MALEDATA_2015_2017,DATA,CWPAGE,num,3,1455,159,CB-2 Current age of R's current W/P,AGEWFPRT2F.,,,0,num,no,0,,yes
NSFG,MALEDATA_2015_2017,DATA,CWPRACE,num,3,1458,160,RACE-recode-like variable for current wife or cohabiting partner,RACEFMT.,,,0,num,no,0,,yes
NSFG,MALEDATA_2015_2017,DATA,CWPNRACE,num,3,1461,161,HISPRACE2-recode-like variable for current wife or cohabiting partner,NRACE.,,,0,num,no,0,,yes
NSFG,MALEDATA_2015_2017,DATA,CWPEDUCN,num,3,1464,162,CB-6 Highest level of education - current W/P,EDUCNF.,,,0,num,no,0,,yes
NSFG,MALEDATA_2015_2017,DATA,CWPBORN,num,3,1467,163,CB-7 Born outside U.S. - current W/P,Y1N5RDF.,,,0,num,no,0,,yes
NSFG,MALEDATA_2015_2017,DATA,CWPMARBF,num,3,1470,164,CB-8 Married before she married R - current W/P,Y1N5RDF.,,,0,num,no,0,,yes
NSFG,MALEDATA_2015_2017,DATA,CWPSX1WN_M,num,3,1473,165,CC-1 Month R first had sex with current W/P,MNTHFMT.,,,0,num,no,0,,yes
NSFG,MALEDATA_2015_2017,DATA,CWPSX1WN_Y,num,4,88,166,CC-1 Year R first had had sex with current W/P,YEARFMT.,,,0,num,no,0,,yes
NSFG,MALEDATA_2015_2017,DATA,CWPSX1AG,num,3,1476,167,CC-2 R's age when 1st had sex with W/P,AGEWFPRT2F.,,,0,num,no,0,,yes
NSFG,MALEDATA_2015_2017,DATA,CMFSXCWP,num,4,92,168,CM of 1st sex with current wife/cohabiting partner,CMFMT.,,,0,num,no,0,,yes
NSFG,MALEDATA_2015_2017,DATA,AGEFSXCWP,num,3,1479,169,R's age at 1st sex with current wife/cohabiting partner,AGEWFPRT2F.,,,0,num,no,0,,yes
NSFG,MALEDATA_2015_2017,DATA,CWPSX1RL,num,3,1482,170,CC-3 Relationship to current W/P at time of 1st sex,RLTNFMT.,,,0,num,no,0,,yes
NSFG,MALEDATA_2015_2017,DATA,CWPFUSE,num,3,1485,171,CC-4 Whether R or CWP used contraception at 1st sex,Y1N5RDF.,,,0,num,no,0,,yes
NSFG,MALEDATA_2015_2017,DATA,CWPFMET01,num,3,1488,172,CC-5 Contraceptive method R or CWP used at 1st sex-1st mention,MTHDSV1F.,,,0,num,no,0,,yes
NSFG,MALEDATA_2015_2017,DATA,CWPFMET02,num,3,1491,173,CC-5 Contraceptive method R or CWP used at 1st sex-2nd mention,MTHDSV1F.,,,0,num,no,0,,yes
NSFG,MALEDATA_2015_2017,DATA,CWPFMET03,num,3,1494,174,CC-5 Contraceptive method R or CWP used at 1st sex-3rd mention,MTHDSV1F.,,,0,num,no,0,,yes
NSFG,MALEDATA_2015_2017,DATA,CWPFMET04,num,3,1497,175,CC-5 Contraceptive method R or CWP used at 1st sex-4th mention,MTHDSV1F.,,,0,num,no,0,,yes
NSFG,MALEDATA_2015_2017,DATA,CWPFMET05,num,3,1500,176,CC-5 cont. method R or CWP used at 1st sex-5th mention,MTHDSV1F.,,,0,num,no,0,,yes
NSFG,MALEDATA_2015_2017,DATA,CWPOPSTR,num,3,1503,177,CD-1 Current W/P ever had sterilizing operation,Y1N5RDF.,,,0,num,no,0,,yes
NSFG,MALEDATA_2015_2017,DATA,CWPTYPOP1,num,3,1506,178,CD-2 Type of sterilizing operation CWP had -1st mentioned,CWPTYPOPF.,,,0,num,no,0,,yes
NSFG,MALEDATA_2015_2017,DATA,CWPTYPOP2,num,3,1509,179,CD-2 Type of sterilizing operation CWP had -2nd mentioned,CWPTYPOPF.,,,0,num,no,0,,yes
NSFG,MALEDATA_2015_2017,DATA,CWPTOTST,num,3,1512,180,CD-3 CWP completely sterile from sterilizing operation,Y1N5RDF.,,,0,num,no,0,,yes
NSFG,MALEDATA_2015_2017,DATA,CWPREVST,num,3,1515,181,CD-4 Current W/P ever had reversal of tubal sterilization,Y1N5RDF.,,,0,num,no,0,,yes
NSFG,MALEDATA_2015_2017,DATA,PSURGSTR,num,3,1518,182,Whether R's Current W/P is Surgically Sterile at Interview,N0Y1CF.,,,0,num,no,0,,yes
NSFG,MALEDATA_2015_2017,DATA,CWPPOSS,num,3,1521,183,CD-5 Physically possible for current W/P to have a baby,Y1N5RDF.,,,0,num,no,0,,yes
NSFG,MALEDATA_2015_2017,DATA,CWPDIFF,num,3,1524,184,CD-6 Physically difficult for current W/P to have a baby,Y1N5RDF.,,,0,num,no,0,,yes
NSFG,MALEDATA_2015_2017,DATA,PSTRSTAT,num,3,1527,185,R's Current W/P's Sterility Status at Time of Interview,PSTRSTAT.,,,0,num,no,0,,yes
NSFG,MALEDATA_2015_2017,DATA,CWPLSXWN_M,num,3,1530,186,CE-2 Month of last sex with current wife/cohabiting partner (when last partner(s) not the CWP),MNTHFMT.,,,0,num,no,0,,yes
NSFG,MALEDATA_2015_2017,DATA,CWPLSXWN_Y,num,4,96,187,CE-2 Year of last sex with current wife/cohabiting partner (when last partner(s) not the CWP),YEARFMT.,,,0,num,no,0,,yes
NSFG,MALEDATA_2015_2017,DATA,CMLSXCWP,num,4,100,188,CM date of last sex with current W/P,CMFMT.,,,0,num,no,0,,yes
NSFG,MALEDATA_2015_2017,DATA,CWPLUSE1,num,3,1533,189,CE-5 R use method at last sex with CWP,Y1N5RDF.,,,0,num,no,0,,yes
NSFG,MALEDATA_2015_2017,DATA,CWPLMET11,num,3,1536,190,CE-6 Method R used at last sex with CWP-1st,MTHDSV2F.,,,0,num,no,0,,yes
NSFG,MALEDATA_2015_2017,DATA,CWPLMET12,num,3,1539,191,CE-6 Method R used at last sex with CWP-2nd,MTHDSV2F.,,,0,num,no,0,,yes
NSFG,MALEDATA_2015_2017,DATA,CWPLMET13,num,3,1542,192,CE-6 Method R used at last sex with CWP-3rd,MTHDSV2F.,,,0,num,no,0,,yes
NSFG,MALEDATA_2015_2017,DATA,CWPLUSE2,num,3,1545,193,CE-7 CWP use contraceptive method at last sex w/R?,Y1N5RDF.,,,0,num,no,0,,yes
